{
  "condition_id": "urn:ssom:condition:p101-cavitation-risk-revised",
  "ssom_version": "0.6.0",
  "condition_type": "cavitation_risk",
  "subject_ref": "urn:ssom:asset:pump-p101",
  "lifecycle_state": "resolved",
  "severity": "low",
  "confidence": 0.79,
  "detected_at": "2026-06-29T10:40:05Z",
  "evidence_refs": [
    "urn:ssom:record:p101-pressure-late-arrival"
  ],
  "provenance": {
    "source_platform": "analytics",
    "source_authority_id": "condition_engine",
    "source_reference": "rule:cavitation-risk-v4-late-data",
    "lineage_id": "ln-cond-p101-cavitation-late-v06",
    "ingest_time": "2026-06-29T10:40:06Z",
    "processing_time": "2026-06-29T10:40:07Z"
  },
  "quality_summary": {
    "status": "good",
    "validation_status": "valid",
    "mapping_confidence": 0.79
  }
}